channel,title,video_duration,video_category,video_viewcount,video_likecount
Sunshine Pictures,The Kerala Story Official Trailer | Vipu,PT2M46S,1,10301244,343372
Think Music India,Mark Antony (Tamil) Official Teaser |Vis,PT2M22S,1,3410727,128462
Family Fitness,FINALLY HUI FAMILY COMPLETE | Family Fit,PT19M39S,24,3387579,134138
T A L K S - LET ME TALK,സിനിമാക്കാർ എന്താ വരാത്തെ?മമ്മൂട്ടി വിളി,PT6M25S,22,750890,5640
Crazy XYZ,24 Hours on Super Bike Challenge- Ninja ,PT26M31S,28,4133027,269525
Shruti TV,Ponniyin Selvan Part 2 Public Review | M,PT8M33S,24,409230,8084
Wanderers Hub,OUR BABY is HERE!! 💙 💗,PT12M2S,22,5026798,270480
Saregama Telugu,Chamkeela Angeelesi - Video Song | Dasar,PT3M31S,10,1856665,43226
Suhana Basheer,Suhana & Bhabiyude Kidilan Dance 😂🤣 | Fa,PT25M27S,22,329369,13006
Paramount Pictures,Transformers: Rise of the Beasts | Offic,PT2M33S,1,11760616,230573
